"scientific.name","common.name","observed.on","location","url"
"Epipactis helleborine","broad-leafed helleborine",2023-08-13,"Agamont Park, Bar Harbor, ME, US","https://www.inaturalist.org/observations/178231077"
"Epipactis helleborine","broad-leafed helleborine",2023-08-11,"Acadia National Park, Hancock County, US-ME, US","https://www.inaturalist.org/observations/177902967"
"Danaus plexippus","monarch",2023-08-10,"Acadia National Park, Bar Harbor, ME, US","https://www.inaturalist.org/observations/177849317"
"Asclepias syriaca","common milkweed",2023-08-09,"Cochrane Point, Acadia National Park, Hancock County, US-ME, US","https://www.inaturalist.org/observations/177537867"
"Lotus corniculatus","bird's-foot trefoil",2023-08-07,"Acadia National Park, Birch Harbor, ME, US","https://www.inaturalist.org/observations/177167457"
"Danaus plexippus","monarch",2023-08-07,"Bar Harbor, ME 04609, USA","https://www.inaturalist.org/observations/177352724"
